{
  "$schema": "https://lhrsolar.org/lhrs-mdc/3.0.0/mdc.schema.json",
  "schemaVersion": "3.0.0",
  "id": "Daybreak",
  "name": "Daybreak",
  "metadata": {
    "name": "Daybreak",
    "source": "dbc2mdc",
    "createdAt": "2026-06-20T18:14:14Z",
    "modifiedAt": "2026-06-20T18:14:14Z"
  },
  "networks": [
    {
      "id": "CarCAN",
      "name": "CarCAN",
      "filename": "CarCAN.dbc",
      "messages": [
        {
          "name": "BPS_Trip",
          "frame_id": 2,
          "is_extended_frame": false,
          "is_fd": false,
          "length": 1,
          "signals": [
            {
              "name": "BPS_Trip",
              "start": 0,
              "length": 1,
              "byte_order": "big_endian",
              "is_signed": false,
              "is_float": false,
              "minimum": 0.0,
              "maximum": 1.0,
              "spn": 0
            }
          ],
          "cycle_time": 1000,
          "protocol": "j1939"
        },
        {
          "name": "BPS_All_Clea",
          "frame_id": 257,
          "is_extended_frame": false,
          "is_fd": false,
          "length": 1,
          "signals": [
            {
              "name": "BPS_All_Clear",
              "start": 0,
              "length": 1,
              "byte_order": "big_endian",
              "is_signed": false,
              "is_float": false,
              "minimum": 0.0,
              "maximum": 1.0,
              "spn": 0
            }
          ],
          "cycle_time": 1000,
          "protocol": "j1939"
        },
        {
          "name": "BPS_Contactor_State",
          "frame_id": 258,
          "is_extended_frame": false,
          "is_fd": false,
          "length": 1,
          "signals": [
            {
              "name": "Array_Contactor",
              "start": 0,
              "length": 1,
              "byte_order": "big_endian",
              "is_signed": false,
              "is_float": false,
              "minimum": 0.0,
              "maximum": 1.0,
              "spn": 0
            },
            {
              "name": "HV_Contactor",
              "start": 2,
              "length": 1,
              "byte_order": "big_endian",
              "is_signed": false,
              "is_float": false,
              "minimum": 0.0,
              "maximum": 1.0,
              "spn": 0
            }
          ],
          "cycle_time": 1000,
          "protocol": "j1939"
        },
        {
          "name": "BPS_Current",
          "frame_id": 259,
          "is_extended_frame": false,
          "is_fd": false,
          "length": 4,
          "signals": [
            {
              "name": "Current",
              "start": 0,
              "length": 32,
              "byte_order": "little_endian",
              "is_signed": true,
              "is_float": false,
              "unit": "mA",
              "minimum": -20000.0,
              "maximum": 100000.0,
              "spn": 0
            }
          ],
          "cycle_time": 1000,
          "protocol": "j1939"
        },
        {
          "name": "BPS_Voltage_Array",
          "frame_id": 260,
          "is_extended_frame": false,
          "is_fd": false,
          "length": 5,
          "signals": [
            {
              "name": "Voltage_idx",
              "start": 0,
              "length": 8,
              "byte_order": "little_endian",
              "is_signed": false,
              "is_float": false,
              "minimum": 0.0,
              "maximum": 31.0,
              "spn": 0
            },
            {
              "name": "Voltage_Value",
              "start": 8,
              "length": 32,
              "byte_order": "little_endian",
              "is_signed": false,
              "is_float": false,
              "unit": "mV",
              "minimum": 0.0,
              "maximum": 1000000.0,
              "spn": 0
            }
          ],
          "cycle_time": 1000,
          "protocol": "j1939"
        },
        {
          "name": "BPS_Temperature_Array",
          "frame_id": 261,
          "is_extended_frame": false,
          "is_fd": false,
          "length": 5,
          "signals": [
            {
              "name": "Temperature_idx",
              "start": 0,
              "length": 8,
              "byte_order": "little_endian",
              "is_signed": false,
              "is_float": false,
              "minimum": 0.0,
              "maximum": 31.0,
              "spn": 0
            },
            {
              "name": "Temperature_Value",
              "start": 8,
              "length": 32,
              "byte_order": "little_endian",
              "is_signed": false,
              "is_float": false,
              "unit": "mC",
              "minimum": 0.0,
              "maximum": 1000000.0,
              "spn": 0
            }
          ],
          "cycle_time": 1000,
          "protocol": "j1939"
        },
        {
          "name": "BPS_SOC",
          "frame_id": 262,
          "is_extended_frame": false,
          "is_fd": false,
          "length": 4,
          "signals": [
            {
              "name": "SoC",
              "start": 0,
              "length": 32,
              "byte_order": "little_endian",
              "is_signed": false,
              "is_float": false,
              "unit": "%",
              "minimum": 0.0,
              "maximum": 100.0,
              "spn": 0
            }
          ],
          "cycle_time": 1000,
          "protocol": "j1939"
        },
        {
          "name": "BPS_WDog_Trigger",
          "frame_id": 263,
          "is_extended_frame": false,
          "is_fd": false,
          "length": 1,
          "signals": [
            {
              "name": "WDog_Trig",
              "start": 0,
              "length": 1,
              "byte_order": "big_endian",
              "is_signed": false,
              "is_float": false,
              "minimum": 0.0,
              "maximum": 1.0,
              "spn": 0
            }
          ],
          "cycle_time": 1000,
          "protocol": "j1939"
        },
        {
          "name": "BPS_CAN_Error",
          "frame_id": 264,
          "is_extended_frame": false,
          "is_fd": false,
          "length": 1,
          "signals": [
            {
              "name": "BPS_CAN_Error",
              "start": 0,
              "length": 1,
              "byte_order": "big_endian",
              "is_signed": false,
              "is_float": false,
              "minimum": 0.0,
              "maximum": 1.0,
              "spn": 0
            }
          ],
          "cycle_time": 1000,
          "protocol": "j1939"
        },
        {
          "name": "BPS_Command",
          "frame_id": 265,
          "is_extended_frame": false,
          "is_fd": false,
          "length": 8,
          "signals": [
            {
              "name": "BPS_Command",
              "start": 0,
              "length": 32,
              "byte_order": "little_endian",
              "is_signed": false,
              "is_float": false,
              "spn": 0
            }
          ],
          "cycle_time": 1000,
          "protocol": "j1939"
        },
        {
          "name": "BPS_Supplemental_Voltage",
          "frame_id": 267,
          "is_extended_frame": false,
          "is_fd": false,
          "length": 2,
          "signals": [
            {
              "name": "Supplemental_Voltage",
              "start": 0,
              "length": 16,
              "byte_order": "little_endian",
              "is_signed": false,
              "is_float": false,
              "unit": "mV",
              "minimum": 0.0,
              "maximum": 65535.0,
              "spn": 0
            }
          ],
          "cycle_time": 1000,
          "protocol": "j1939"
        },
        {
          "name": "BPS_Charge_Enabled",
          "frame_id": 268,
          "is_extended_frame": false,
          "is_fd": false,
          "length": 1,
          "signals": [
            {
              "name": "Charge_Enabled",
              "start": 0,
              "length": 1,
              "byte_order": "big_endian",
              "is_signed": false,
              "is_float": false,
              "minimum": 0.0,
              "maximum": 1.0,
              "spn": 0
            }
          ],
          "cycle_time": 1000,
          "protocol": "j1939"
        },
        {
          "name": "BPS_Voltage_Summary",
          "frame_id": 269,
          "is_extended_frame": false,
          "is_fd": false,
          "length": 8,
          "signals": [
            {
              "name": "Pack_Voltage",
              "start": 0,
              "length": 24,
              "byte_order": "little_endian",
              "is_signed": false,
              "is_float": false,
              "unit": "mV",
              "minimum": 0.0,
              "maximum": 16777215.0,
              "spn": 0
            },
            {
              "name": "Voltage_Range",
              "start": 24,
              "length": 24,
              "byte_order": "little_endian",
              "is_signed": false,
              "is_float": false,
              "unit": "mV",
              "minimum": 0.0,
              "maximum": 16777215.0,
              "spn": 0
            },
            {
              "name": "Voltage_Timestamp",
              "start": 48,
              "length": 16,
              "byte_order": "little_endian",
              "is_signed": false,
              "is_float": false,
              "unit": "ms",
              "minimum": 0.0,
              "maximum": 65535.0,
              "spn": 0
            }
          ],
          "cycle_time": 1000,
          "protocol": "j1939"
        },
        {
          "name": "BPS_Temperature_Summary",
          "frame_id": 270,
          "is_extended_frame": false,
          "is_fd": false,
          "length": 8,
          "signals": [
            {